{
  "report_type": "holding_review_v1",
  "ticker": "CPS",
  "date": "2026-03-08",
  "version": "v1",
  "verdict": "HOLD_AND_MONITOR",
  "thesis_status": "INTACT_BUT_SLOWER",
  "research_retrieval_note": {
    "primary_retrieval_path": "Gemini Grounded Search",
    "gemini_tried_first": true,
    "websearch_fallback_used": false,
    "fallback_reason": "not needed"
  },
  "portfolio_context": {
    "avg_cost": "$14",
    "current_price": "$32",
    "unrealized_gain": "+129%",
    "weight": "~25%",
    "original_target": "$193 (known stale)",
    "thesis": "Auto-parts turnaround with operating leverage and margin recovery potential",
    "prior_review": "2026-03-07 v5: HOLD, recommended revising target from $193 to ~$92"
  },
  "current_forward_return_cagr_pct": 49.01,
  "sell_trigger_status": {
    "t1": "no",
    "t2": "no",
    "t3": "no"
  },
  "thesis_integrity_checklist": [
    {
      "question": "Are catalysts showing up on schedule?",
      "answer": "MIXED. FY2025 Adj EBITDA improved to $209.7M (7.6% margin) from $180.7M, but Q4 2025 margins regressed to 5.2% due to customer production disruptions and inflation. FCF dropped to $16.3M from $25.9M. 2026 guidance targets $280M Adj EBITDA (~10% margin) which would be a significant step-up. Debt refinancing completed March 2026, extending maturities to 2031 -- a major deleveraging catalyst achieved."
    },
    {
      "question": "Is management saying one thing, doing another?",
      "answer": "LARGELY CONSISTENT. CEO Edwards (tenure since 2012) delivered on organizational restructuring (product-line focus from 2024), China growth pivot (74% of new business wins EV-related, targeting 60%+ China OEM share by 2030), and debt refinancing. However, Q4 2025 margin miss vs full-year trajectory raises execution questions for 2026 ramp."
    },
    {
      "question": "Are margins shifting unexpectedly?",
      "answer": "IMPROVING TREND WITH SETBACK. Full-year gross margin improved from 5.1% (FY2022) to 11.7% (FY2025), but the Q4 dip (5.2% Adj EBITDA margin vs 8.2% prior year Q4) signals vulnerability to volume/mix headwinds. Targeted 10%+ Adj EBITDA margin for FY2026 is ambitious given the Q4 trajectory."
    },
    {
      "question": "Are competitors pulling ahead?",
      "answer": "NO MATERIAL DRIFT. CPS retains #1 global position in sealing systems, #2 in fuel/brake delivery, #3 in fluid transfer. 8.3% market share in auto parts. $298M new business wins in 2025 with 74% EV/hybrid-related shows positioning for industry transition."
    },
    {
      "question": "Which macro events matter?",
      "answer": "US light vehicle sales projected to decline to 15.6M in 2026 (from 16.1M in 2025). BEV adoption stagnating but hybrid growing. China OEM growth (15%+ CAGR 2025-2028) is a meaningful tailwind. Tariff/trade policy risk exists but not yet triggered for auto parts. Global light vehicle production growth flat to slightly negative in 2026."
    }
  ],
  "catalyst_tracking": [
    {
      "catalyst": "Margin recovery",
      "original_timing": "2025-2028",
      "current_status": "DEVELOPING",
      "evidence": "FY2025 Adj EBITDA margin 7.6% (up from 6.6% in FY2024), but Q4 regressed to 5.2%. 2026 target is 10%+ margin. Gross margin improved from 5.1% (FY2022) to 11.7% (FY2025). Operating income turned positive at $107M in FY2025.",
      "verdict": "Progress visible on annual basis but Q4 setback tempers confidence. 10% EBITDA target for 2026 is achievable if volume headwinds stabilize."
    },
    {
      "catalyst": "Execution stability",
      "original_timing": "Ongoing",
      "current_status": "ON_TRACK",
      "evidence": "Organizational restructuring to product-line focus complete. CEO Edwards in place since 2012 providing continuity. New business wins of $298M in 2025. China strategy executing with 36% China revenue targeting 60%+ by 2030.",
      "verdict": "Management executing on strategic initiatives. Long CEO tenure provides stability."
    },
    {
      "catalyst": "Debt refinancing / deleveraging",
      "original_timing": "2026-2028",
      "current_status": "ON_TRACK",
      "evidence": "March 2026 refinancing issued $1.1B in 9.25% secured notes due 2031, retiring all 2026-2027 maturities. Near-term liquidity risk eliminated. Target net leverage 2x by 2028. S&P expects adjusted debt/EBITDA of 5.4x in 2026.",
      "verdict": "Major positive catalyst achieved. Maturity wall cleared. High coupon (9.25%) constrains FCF but survival risk substantially reduced."
    },
    {
      "catalyst": "China OEM growth",
      "original_timing": "2025-2030",
      "current_status": "DEVELOPING",
      "evidence": "China revenue from Chinese OEMs at 36%, targeting 60%+ by 2030. Total China revenue projected 15%+ CAGR 2025-2028. Total sales to Chinese OEMs globally expected to triple over 5 years.",
      "verdict": "New catalyst not in original thesis. Potentially significant revenue diversification and growth driver."
    }
  ],
  "management_consistency": {
    "what_management_said": "CEO Edwards committed to margin recovery through organizational restructuring, cost optimization, and pivot to EV/hybrid content. Targeted deleveraging to 2x net leverage by 2028. Guided for positive FCF and improving EBITDA margins.",
    "what_management_did": "Delivered product-line reorganization in 2024. Completed $1.1B debt refinancing in March 2026 extending maturities to 2031. Adj EBITDA improved from $180.7M to $209.7M (FY2024 to FY2025). Generated positive FCF in FY2024 and FY2025. Won $298M new business with 74% EV-related. However, Q4 2025 showed margin regression and missed analyst EPS estimates.",
    "match_mismatch": "MATCH on strategic execution and deleveraging. PARTIAL MISMATCH on near-term margin consistency -- Q4 2025 was a setback against the improving trend."
  },
  "margin_competitor_drift": {
    "margin_change": "Significant improvement: Gross margin from 5.1% (FY2022) to 11.7% (FY2025). Adj EBITDA margin from 0.02% (FY2022) to 7.6% (FY2025). However, still well below pre-COVID levels (18.5% gross margin FY2017). Q4 2025 regression (5.2% Adj EBITDA) is a concern.",
    "competitor_drift": "CPS maintains #1 sealing, #2 fuel/brake, #3 fluid transfer globally. 8.3% market share. No competitor displacement evident. EV content positioning (74% of new wins) demonstrates adaptation to industry transition.",
    "open_risks": [
      "Negative equity (-$83.5M) persists -- probability ceiling of 60% triggered",
      "Total debt of $1.26B with 9.25% coupon = ~$102M annual interest, consuming most operating cash flow",
      "US light vehicle sales projected to decline in 2026 (15.6M vs 16.1M in 2025)",
      "Q4 2025 margin regression may indicate structural headwinds not fully resolved",
      "Heavy OEM customer concentration (Ford, GM, Stellantis) creates dependency risk",
      "FCF declining trend: $36.5M (FY2023) -> $25.9M (FY2024) -> $16.3M (FY2025)"
    ]
  },
  "forward_return_refresh": {
    "base_case_assumptions": [
      "Revenue: $2.82B (2026 guidance ~3% growth on $2.74B = ~$2.82B)",
      "FCF margin: 4.5% (10% Adj EBITDA target minus ~3.5% capex minus ~2% interest = ~4.5% FCF margin on optimistic read; conservative given $16.3M FCF on $2.74B = 0.59% current)",
      "FCF multiple: 10x (cyclical/industrial baseline 12-15x minus -3x leverage discount minus -2x negative equity risk = ~7-10x; using top of discounted range given debt maturity extension)",
      "Shares: 17.86M (current diluted, no buyback credit)",
      "Time horizon: 2 years (target date 2028)"
    ],
    "valuation_command": "bash scripts/calc-score.sh valuation 2.82 4.5 10 17.86",
    "valuation_json": {
      "revenue_b": 2.82,
      "fcf_margin_pct": 4.5,
      "fcf_b": 0.1269,
      "multiple": 10.0,
      "shares_m": 17.86,
      "target_price": 71.05
    },
    "cagr_command": "bash scripts/calc-score.sh cagr 32 71.05 2",
    "cagr_json": {
      "current_price": 32.0,
      "target_price": 71.05,
      "years": 2.0,
      "cagr_pct": 49.01,
      "meets_hurdle": true,
      "hurdle": 30
    },
    "forward_return_command": "bash scripts/calc-score.sh forward-return 32 2.82 4.5 10 17.86 2",
    "forward_return_json": {
      "current_price": 32.0,
      "revenue_b": 2.82,
      "fcf_margin_pct": 4.5,
      "multiple": 10.0,
      "shares_m": 17.86,
      "years": 2.0,
      "target_price": 71.05,
      "forward_cagr_pct": 49.01,
      "meets_30pct_hurdle": true,
      "meets_15pct_guardrail": true,
      "below_10pct_warning": false
    },
    "refreshed_target_price": "$71.05",
    "refreshed_cagr_pct": 49.01,
    "clears_30pct_hurdle": true,
    "clears_rapid_move_guardrail": true
  },
  "worst_case_floor": {
    "material": true,
    "summary": "Negative FCF margin trough produces negative floor price, implying equity wipeout risk in worst case. Downside scored at 100% (capped). Negative equity (-$83.5M) and TBV/share of -$14.65 confirm structural solvency risk. However, March 2026 debt refinancing extended all maturities to 2031, substantially reducing near-term survival risk.",
    "floor_command": "bash scripts/calc-score.sh floor 2.39 -8.87 6 17.86 32",
    "floor_json": {
      "revenue_b": 2.39,
      "fcf_margin_pct": -8.87,
      "fcf_b": -0.212,
      "multiple": 6.0,
      "shares_m": 17.86,
      "current_price": 32.0,
      "floor_price": -71.22,
      "downside_pct": 322.56
    },
    "trough_path": [
      {
        "input": "Revenue",
        "value": "$2.39B",
        "fiscal_year": "FY2021",
        "data_point": "income statement, lowest 5yr TTM revenue"
      },
      {
        "input": "FCF Margin",
        "value": "-8.87%",
        "fiscal_year": "FY2021",
        "data_point": "FCF -$211.6M / revenue $2.39B; lowest 5yr margin"
      },
      {
        "input": "FCF Multiple",
        "value": "6x",
        "fiscal_year": "N/A",